ID,Name *,Reference #*,Price*,Friendly-url*,Ean-13,UPC,Active(0/1),visibility(both/catalog/search/none),Condition(new/used/refurbished),Available for order (0 = No /1 = Yes),Show Price,Available online only (0 = No/ 1 = Yes),Short Description,Description,Tags(x—y--z..),Wholesale Price,Unit price,Special Price,special price start date,Special Price End Date,On sale (0/1),Meta Title,Meta Description,Image Url(x—y--z..),Quantity,Out of stock,Minimal Quantity,Product available date,Text when in stock,Text when backorder allowed,Category Id(x--y--z..),Default Category id,Width,height,depth,weight,Additional shipping cost,feature(Name:Value)
0,COAT - BLUE 46034-2,17883,42.29,,,,1,both,new,1,1,0,"Coat with a hood and the ability to pull on the waist.<br /><br />Materiał: 100% poliester, 100% poliamid","Coat with a hood and the ability to pull on the waist.<br /><br />Materiał: 100% poliester, 100% poliamid",COATBLUE460342,34.38,42.29,42.29,2020-11-01,2020-12-31,1,COAT - BLUE 46034-2,COAT - BLUE 46034-2,https://yournewstyle.pl/files/clothes/preview/ab364467f342a935db314d40d4513780.jpg,0,0,1,2020-05-05,In Stock,"current Supply, ordering avilabel",1120;1119,1117,10,10,10,2,,
0,JACKET - MUSTARD 46033-3,17881,38.42,,,,1,both,new,1,1,0,"Jacket with detachable sleeves.<br /><br />Materiał: 100% poliester, 100% poliamid","Jacket with detachable sleeves.<br /><br />Materiał: 100% poliester, 100% poliamid",JACKETMUSTARD460333,31.23,38.42,38.42,2020-11-01,2020-12-31,1,JACKET - MUSTARD 46033-3,JACKET - MUSTARD 46033-3,https://yournewstyle.pl/files/clothes/preview/209f2f0dcc295687dd6ec82bfed9ec4f.jpg,0,0,1,2020-05-05,In Stock,"current Supply, ordering avilabel",1120;1119,1117,10,10,10,2,,
0,JACKET - SALOMON 46033-1,17879,38.42,,,,1,both,new,1,1,0,"Jacket with detachable sleeves.<br /><br />Materiał: 100% poliester, 100% poliamid","Jacket with detachable sleeves.<br /><br />Materiał: 100% poliester, 100% poliamid",JACKETSALOMON460331,31.23,38.42,38.42,2020-11-01,2020-12-31,1,JACKET - SALOMON 46033-1,JACKET - SALOMON 46033-1,https://yournewstyle.pl/files/clothes/preview/f7e6db32261386b3d1d6bc79c6fce818.jpg,0,0,1,2020-05-05,In Stock,"current Supply, ordering avilabel",1120;1119,1117,10,10,10,2,,
0,JACKET - KHAKI 46005-2,17823,35.14,,,,1,both,new,1,1,0,Jacket with sequins and pockets at the front.<br /><br />Materiał: 100% bawełna,Jacket with sequins and pockets at the front.<br /><br />Materiał: 100% bawełna,JACKETKHAKI460052,28.57,35.14,35.14,2020-11-01,2020-12-31,1,JACKET - KHAKI 46005-2,JACKET - KHAKI 46005-2,https://yournewstyle.pl/files/clothes/preview/b5b6a09a07541a18c50c857bc2f38c44.jpg,0,0,1,2020-05-05,In Stock,"current Supply, ordering avilabel",1120;1119,1117,10,10,10,2,,
0,JACKET - NAVY BLUE 46005-1,17822,35.14,,,,1,both,new,1,1,0,Jacket with sequins and pockets at the front.<br /><br />Materiał: 100% bawełna,Jacket with sequins and pockets at the front.<br /><br />Materiał: 100% bawełna,JACKETNAVYBLUE460051,28.57,35.14,35.14,2020-11-01,2020-12-31,1,JACKET - NAVY BLUE 46005-1,JACKET - NAVY BLUE 46005-1,https://yournewstyle.pl/files/clothes/preview/09a45789ed9760ae79d7c397d0fa37c7.jpg,0,0,1,2020-05-05,In Stock,"current Supply, ordering avilabel",1120;1119,1117,10,10,10,2,,
0,JACKET - BLACK 46004-1,17821,35.14,,,,1,both,new,1,1,0,Jacket / parka with sequins and a hood.<br /><br />Materiał: 100% bawełna,Jacket / parka with sequins and a hood.<br /><br />Materiał: 100% bawełna,JACKETBLACK460041,28.57,35.14,35.14,2020-11-01,2020-12-31,1,JACKET - BLACK 46004-1,JACKET - BLACK 46004-1,https://yournewstyle.pl/files/clothes/preview/79ad2f76b24592b55b58e21e0849d5ef.jpg,0,0,1,2020-05-05,In Stock,"current Supply, ordering avilabel",1120;1119,1117,10,10,10,2,,
0,COAT - PISTACHIO 32001-4,17548,29.48,,,,1,both,new,1,1,0,Coat with fleece lining<br /><br />Materiał: 100% poliester,Coat with fleece lining<br /><br />Materiał: 100% poliester,COATPISTACHIO320014,23.97,29.48,29.48,2020-11-01,2020-12-31,1,COAT - PISTACHIO 32001-4,COAT - PISTACHIO 32001-4,https://yournewstyle.pl/files/clothes/preview/083f107b0751be58ad02a8986bf79566.jpg,0,0,1,2020-05-05,In Stock,"current Supply, ordering avilabel",1120;1119,1117,10,10,10,2,,
0,"3616-2 Jeans jacket buttoned, short - blue",2542,13.4,,,,1,both,new,1,1,0,"Short denim jacket buttoned. Made from a very good genre material. The trendiest fashion this season.<br /><br />Materiał: 75% Bawełna, 23% Poliester, 2% Elastan","Short denim jacket buttoned. Made from a very good genre material. The trendiest fashion this season.<br /><br />Materiał: 75% Bawełna, 23% Poliester, 2% Elastan",36162Jeansjacketbuttonedshortblue,10.9,13.4,13.4,2020-11-01,2020-12-31,1,"3616-2 Jeans jacket buttoned, short - blue","3616-2 Jeans jacket buttoned, short - blue",https://yournewstyle.pl/files/clothes/preview/a9c0a5bd3d01ece7bed5d2f9a7127744.jpg,0,0,1,2020-05-05,In Stock,"current Supply, ordering avilabel",1120;1119,1117,10,10,10,2,,
